2455,"private investors, SICTIC",1.3,,,https://www.cerchia.io/,0.0,0.0,2022-02-01,VC,Early Stage,ZG,Cerchia AG,Male
2456,"SICTIC, Serpentine Ventures, Aare Ventures, private investors",0.61,,,https://coatingai.com/,0.0,0.0,2022-05-01,VC,Seed,ZH,coatingAI AG,Male
2457,"private investors, SICTIC",1.2,,,https://covalo.com/,0.0,0.0,2022-10-01,VC,Early Stage,ZH,Covalo AG,Male
2458,"Sequoia Capital Arc, Gaingels Network, NEXTBLUE, Thilo Konzok",1.5,,,https://www.startupticker.ch/en/news/creatorspace-raises-1-6m-pre-Seed-round-with-sequoia,0.0,0.0,2022-08-01,VC,Seed,ZH,ClearSpace SA,Male
2459,"private investors, SICTIC",1.0,,,https://www.cynos.ch/,0.0,0.0,2022-04-01,VC,Early Stage,ZH,Cynos AG,Male
2460,institutional investors advised by J.P. Morgan Global Alternatives' Global Transportation Group,3.0,,,https://www.startupticker.ch/en/news/daphne-technology-raises-chf-3-million-with-j-p-morgan-as-new-investor,0.0,0.0,2022-12-01,VC,Later Stage,VD,Daphne Technology SA,Male
2383,Fund for Sustainability and Energy (FUND4SE PTE),1.83,,,https://www.startupticker.ch/en/news/singapore-based-cleantech-fund-invests-in-sohhytec,0.0,0.0,2022-01-01,VC,Seed,VD,SoHHytec SA,Male
2384,"VI Partners, Acton",10.0,,,https://www.startupticker.ch/en/news/skribble-scoops-chf-1-million-to-scaleup-e-signature-service,0.0,0.0,2022-09-01,VC,Early Stage,ZH,Skribble AG,Male
2385,"Verve Ventures, ZKB, Höhle der Löwen Schweiz, US health insurance company",6.2,12.50061799,,https://www.startupticker.ch/en/news/sleepiz-closes-series-a-round-at-chf-6-2-million,0.0,0.0,2022-03-01,VC,Early Stage,ZH,Sleepiz AG,Male
2386,"Privilège Ventures, NewOak,  DAA Capital Partners, Akiden Ventures, SICTIC",3.8,,,https://www.startupticker.ch/en/news/smeetz-leve-plus-de-4-millions-et-vise-le-marche-us,0.0,0.0,2022-05-01,VC,Early Stage,VD,Smeetz SA,Male
2387,"Wingman Ventures, Acequia Capital, Gian Reto à Porta",0.7,3.8000718,,https://www.startupticker.ch/en/news/snipd-closes-oversubscribed-pre-Seed-funding-round,0.0,0.0,2022-03-01,VC,Seed,ZH,Snipd AG,Male
2388,"private investors, Aare Ventures",2.2,,,https://www.startupticker.ch/en/news/spacetek-technology-2-2-millionen-fuer-wachstumsphase,0.0,0.0,2022-07-01,VC,Seed,BE,Spacetek Technology AG,Male
2389,Singular,5.6,,,https://www.startupticker.ch/en/news/sparta-raised-6-million-to-expand-its-commodity-technology-offering,0.0,0.0,2022-03-01,VC,Early Stage,GE,Sparta Commodities SA,Male
2323,"New Enterprise Associates (NEA), Speedinvest, existing investors including Sequoia Capital, 20VC, btov, VI Partners",21.2,,,https://www.startupticker.ch/en/news/ledgy-banks-22-million-in-series-b-round,0.0,0.0,2022-09-01,VC,Later Stage,ZH,Ledgy AG,Female
2325,Private investors,,,,https://www.startupticker.ch/en/news/ls-instruments-secures-investment-to-boost-growth-in-the-pharmaceutical-sector,0.0,0.0,2022-02-01,VC,Later Stage,FR,LS Instruments AG,Male
2326,"Dominik Lysek, ZKB, N&V Capital, Business Angels Switzerland",0.9,,,https://www.startupticker.ch/en/news/lumendo-scores-oversubscribed-investment-round,0.0,0.0,2022-06-01,VC,Seed,VD,Odne AG (Lumendo AG),Male
2327,"Crowdinvesting (Companisto), SICTIC, private investors",1.7,,,https://www.startupticker.ch/en/news/luzern-based-startup-raises-1-6-million,0.0,0.0,2022-01-01,VC,Early Stage,LU,wearonize AG,Male
2328,"Sitem StartUup Club, Guido Fluri Foundation",3.2,,,https://www.startupticker.ch/en/news/machinmd-finalises-oversubscribed-Seed-round,0.0,0.0,2022-09-01,VC,Seed,BE,machineMD AG,Male
2329,Dynamk Capital,2.9,,,https://www.startupticker.ch/en/news/medtech-startup-bionter-secures-3-million-Seed-financing,0.0,0.0,2022-04-01,VC,Seed,BL,Bionter AG,Male
2330,"UVC Partners, Valentin Stalf, Cornelius Boersch, Emanuel Thomassin, Alois Flatz",6.7,18.02637648,,https://www.startupticker.ch/en/news/mehrwegsystem-kooky-sichert-sich-finanzierung-u-ber-sechs-millionen-euro,0.0,0.0,2022-04-01,VC,Early Stage,ZH,CEBS AG (kooky),Male
2331,"Swisscanto Invest, Adjuvant Capital, Fresenius Medical Care Ventures, GF Group, Verve Ventures, Vesalius Biocapital, Zürcher Kantonalbank ZKB",23.0,56.28084,,https://www.startupticker.ch/en/news/memo-therapeutics-raises-chf-23-million,0.0,0.0,2022-02-01,VC,Later Stage,ZH,CancerNewCo@Memo Therapeutics AG,Male
2332,"Micron Ventures, Lenovo, Verve Ventures, SICTIC, Family Office Schwarzwälder Bote (Redstone), Forefront Venture Partners",7.5,,,https://www.startupticker.ch/en/news/micron-technology-and-lenovo-invest-in-swiss-metaverse-start-up,0.0,0.0,2022-03-01,VC,Early Stage,AG,holo one AG,Male
2333,"Sparrow Ventures, other investors",2.0,,,https://www.startupticker.ch/en/news/migros-tochter-sparrow-ventures-beteiligt-sich-an-camping-plattform-nomady,0.0,0.0,2022-06-01,VC,Early Stage,SZ,Nomady AG,Male
2334,Concord Health Partners and others,96.7,,,https://www.startupticker.ch/en/news/mindmaze-secures-15-million-financing,0.0,0.0,2022-02-01,VC,Later Stage,VD,MindMaze SA,Male
2335,"StartAngels Network, business angels",1.0,,,https://www.startupticker.ch/en/news/mit-alkoholfreien-spirituosen-europa-erobern,0.0,0.0,2022-02-01,VC,Seed,ZH,Freespirited Drinks AG (REBELS 0.0% ),Male
2336,Boundary Holding,0.7,,,https://www.startupticker.ch/en/news/momentum-and-capital-for-aero41,0.0,0.0,2022-09-01,VC,Early Stage,VD,Aero41 SA,Male
2337,"Redalpine,  Polytech Ventures, Fulgur Ventures, ACE & Company, SICTIC",2.2,,,https://www.startupticker.ch/en/news/more-than-2-1-million-for-bitcoin-app,0.0,0.0,2022-05-01,VC,Early Stage,ZH,Relai AG,Male
2338,Forty51 Ventures,,,,https://www.startupticker.ch/en/news/mosanna-therapeutics-completes-Seed-round,0.0,0.0,2022-07-01,VC,Seed,BS,Mosanna Therapeutics AG,Male
2339,new and existing investors,1.0,,,https://www.startupticker.ch/en/news/multiwave-raises-usd-1m-and-delivers-its-first-portable-mri-devices,0.0,0.0,2022-09-01,VC,Early Stage,GE,Multiwave Technologies AG,Male
2340,US-based and NASDAQ listed life science investor and Taiwania Capital,18.5,,,https://www.startupticker.ch/en/news/nanolive-banks-2-million-in-series-c1-round,0.0,0.0,2022-04-01,VC,Later Stage,VD,Nanolive SA,Male
2341,"Bruker Invest AG, Think.Health Ventures, Ventura Biomed Investors, Zürcher Kantonalbank ZKB",7.5,,,https://www.startupticker.ch/en/news/navignostics-raises-chf-7-5m-to-advance-precision-cancer-medicine,0.0,0.0,2022-11-01,VC,Seed,ZH,Navignostics AG,Female
2342,n.a,7.7,27.1533032,,https://www.startupticker.ch/en/news/nemis-technologies-closes-chf7-75-million-series-a-funding-round,0.0,0.0,2022-02-01,VC,Early Stage,ZH,NEMIS TECHNOLOGIES AG,Male
2343,"Swisscom Ventures, other investors",19.0,,,https://www.startupticker.ch/en/news/neo-medical-leve-usd-2-6-millions-avec-swisscom-ventures,0.0,0.0,2022-02-01,VC,Later Stage,VD,Neo Medical SA,Male
2344,"Alven, Aster, CNB, HTGF",8.5,,,https://www.startupticker.ch/en/news/neural-concept-raises-a-9-1m-series-a,0.0,0.0,2022-03-01,VC,Early Stage,VD,Neural Concept SA,Male
2345,"Signature Ventures, Polymorphic Capital.",3.0,,,https://www.startupticker.ch/en/news/nevermined-3-million-to-make-web3-easier,0.0,0.0,2022-07-01,VC,Seed,ZG,Nevermined,Male
2346,Versant Ventures,46.0,53.17189,,https://www.startupticker.ch/en/news/newly-launched-biotech-banks-chf46-million,0.0,0.0,2022-04-01,VC,Early Stage,BS,Cimeio Therapeutics AG,Female
2347,"Humboldt Fund, Broadview Ventures, Apollo Health Ventures, BERNINA BioInvest, 4See Ventures, Schroder Adveq, Viva BioInnovator",4.6,,,https://www.startupticker.ch/en/news/new-us-laboratory-and-funding-for-haya-therapeutics,0.0,0.0,2022-02-01,VC,Seed,VD,HAYA Therapeutics SA,Male
2348,"ZFV Unternehmungen, private investors",1.8,6.8,,https://www.startupticker.ch/en/news/nexenic-sammelt-1-8-millionen-fuer-markteintritt-des-portablen-steamers,0.0,0.0,2022-06-01,VC,Early Stage,ZH,Nexenic AG (Steasy),Male
2349,n.a.,,,,https://www.startupticker.ch/en/news/no-code-ai-company-amplo-raises-first-investment-round,0.0,0.0,2022-01-01,VC,Seed,ZH,Amplo AG,Male
2350,"Manuel Grenacher, Julian Liniger, Fabian Knup",0.3,1.39999959,,https://www.startupticker.ch/en/news/noii-schliesst-Seedrunde-ab,0.0,0.0,2022-04-01,VC,Seed,ZH,noii land AG,Male
2351,new and existing investors,18.8,,,https://www.startupticker.ch/en/news/novigenix-attracts-funding-to-advance-precision-oncology-solutions,0.0,0.0,2022-11-01,VC,Later Stage,VD,Novigenix SA,Male
2352,private investors (Höhle der Löwen),0.6,3.38,,https://www.startupticker.ch/en/news/oioioi-babykleidung-im-monatsabo,0.0,0.0,2022-06-01,VC,Seed,ZH,OIOIOI,Female
2353,"Bstartup (Banco Sabadell), Katapult.vc, Great Stuff Ventures, Business Angels Switzerland",1.0,,,https://www.startupticker.ch/en/news/one-million-usd-to-fast-track-wegaw-climate-tech,0.0,0.0,2022-02-01,VC,Seed,VD,Wegaw SA,Male
2354,"Longitude Capital, Northpond Ventures, Melo Ventures",35.8,,,https://www.startupticker.ch/en/news/opna-bio-launches-with-38-million-series-a-financing,0.0,0.0,2022-11-01,VC,Early Stage,VD,Opna Immuno-Oncology Ltd,Male
2355,AP Ventures,5.0,,,https://www.startupticker.ch/en/news/over-chf-5m-raised-to-advance-eh-group-zero-emission-fuel-cell-technology,0.0,0.0,2022-01-01,VC,Early Stage,VD,EH Group Engineering AG,Male
2356,"ACE & Company, READ-HP Investments, Seldor Capital, NYC-based Venture Capital firm, Polysis Industries",,,,https://www.startupticker.ch/en/news/oversubscribed-swisspod-Seed-round-to-disrupt-mobility,0.0,0.0,2022-02-01,VC,Seed,VS,Swisspod Technologies SA,Male
2357,"SICTIC, FONGIT",1.6,,,https://www.startupticker.ch/en/news/ovomind-gets-closer-to-beta-deployment,0.0,0.0,2022-10-01,VC,Seed,GE,OVOMIND SA,Male
2358,Serpentine Ventures,,,,https://www.startupticker.ch/en/news/patchxr-welcomes-first-institutional-investor,0.0,0.0,2022-03-01,VC,Seed,ZH,PatchXR AG,Male
2359,Business angels,0.13,,,https://www.startupticker.ch/en/news/pelt8-completes-first-financing-round,0.0,0.0,2022-05-01,VC,Seed,ZH,Pelt8 AG,Male
2360,"PCS Holding, other investor",,10.0,,https://www.startupticker.ch/en/news/peter-spuhler-investiert-in-e-transporter-startup-flux-mobility,0.0,1.0,2022-06-01,VC,Seed,ZH,Flux Mobility,Male
2361,Pfizer Breakthrough Growth Initiative,35.1,,,https://www.startupticker.ch/en/news/pfizer-invests-35-million-in-anokion,0.0,0.0,2022-10-01,VC,Later Stage,VD,Anokion SA,Male
2362,"Swiss Diabetes Venture Fund, Verve Ventures, Zürcher Kantonalbank ZKB, NEST pension fund",7.5,,,https://www.startupticker.ch/en/news/piomic-medical-raises-chfm-7-5-oversubscribed-financing-round,0.0,0.0,2022-07-01,VC,Early Stage,ZH,Piomic Medical AG,Male
2363,"StartAngels Network, Forward VC, ZKB, Plug and Play",2.1,8.71,,https://www.startupticker.ch/en/news/pipra-concludes-chf-2-1-million-Seed-round,0.0,0.0,2022-06-01,VC,Seed,ZH,PIPRA AG,Male
2364,"L.Catterton, Vorwerk Ventures, Gullspång Re:food, Be8 Ventures, ACE, ETH Zurich Foundation, Tengelmann Ventures, Joyance, Yann Sommer",70.0,,,https://www.startupticker.ch/en/news/planted-closes-chf-7-million-series-b-financing-round,0.0,0.0,2022-09-01,VC,Later Stage,ZH,Planted Foods AG,Male
2365,Dow Venture Capital,,,,https://www.startupticker.ch/en/news/plastogaz-attracts-strategic-investment-from-dow,0.0,0.0,2022-03-01,VC,Seed,VD,Plastogaz SA,Male
2366,"Fairway Asset Management,  4FO Venture Partners, EIC Fund, Zürcher Kantonalbank ZKB, ETH Foundation",5.5,,,https://www.startupticker.ch/en/news/positrigo-ready-for-the-commercialisation-phase-after-raising-chf-5-5-million,0.0,0.0,2022-10-01,VC,Later Stage,ZH,Positrigo AG,Male
2367,Steven Nzonzi,,,,https://www.startupticker.ch/en/news/prominent-investor-for-coachbetter,0.0,0.0,2022-11-01,VC,Seed,ZH,Coachbetter AG,Male
2368,"Serpentine Ventures, Sparrow Ventures, Ertan Wittwer, business angels",6.0,,,https://www.startupticker.ch/en/news/properti-erhaelt-weitere-sechs-millionen-Seed-kapital,0.0,0.0,2022-06-01,VC,Seed,ZH,Properti,Male
2369,Ferrum,2.3,16.7895,,https://www.startupticker.ch/en/news/qualysense-raises-2-5-million-to-continue-market-expansion-in-usa,0.0,0.0,2022-01-01,VC,Later Stage,ZH,QualySense AG,Male
2370,"Heiko Hubertz, For One Red, William Candillon, Sebastien Lorber, Spotify engineers, Musixmatch engineers, customers",0.2,,,https://www.startupticker.ch/en/news/remotion-secures-capital-to-simplify-programmatic-video-creation,0.0,0.0,2022-11-01,VC,Seed,ZH,Remotion AG,Male
2371,"private investors, SICTIC",,8.0,,https://www.startupticker.ch/en/news/saas-startup-caplena-raises-7-figure-Seed-round,0.0,1.0,2022-04-01,VC,Seed,ZH,Caplena AG,Male
2372,"session.vc, angels",0.6,,,https://www.startupticker.ch/en/news/salesplaybook-secures-eur-66--in-Seed-round,0.0,0.0,2022-09-01,VC,Seed,ZH,SalesPIaybook,Male
2373,"session.vc, Lightbird Ventures",2.5,,,https://www.startupticker.ch/en/news/saporo-to-take-business-cyber-resistance-next-level,0.0,0.0,2022-01-01,VC,Seed,VD,Saporo SA,Male
2374,n.a.,,14.09631313,,https://www.startupticker.ch/en/news/scailyte-completes-first-close-of-series-a-round,0.0,0.0,2022-01-01,VC,Early Stage,BS,Scailyte AG,Male
2375,"Warburg Pincus, Atomico, Forestay Capital, G2VP, GV, Kreos, NGP Capital, Schneider Electric, Sony Innovation Fund by IGV, Swisscom Ventures",138.6,820.4834596,,https://www.startupticker.ch/en/news/scandit-hits-unicorn-valuation-with-new-funding-round,0.0,0.0,2022-02-01,VC,Later Stage,ZH,Scandit AG (Mirasense AG),Male
2376,"Altive, Ordway Selections, Summer Capital, Zug based family office, DeFi Technologies, Alameda Research, FTX",110.0,,,https://www.startupticker.ch/en/news/seba-bank-raises-chf-11-million-to-fuel-international-growth,0.0,0.0,2022-01-01,VC,Later Stage,ZG,Amina Bank (SEBA Bank AG),Male
2377,"existing investors, SICTIC",3.3,,,https://www.startupticker.ch/en/news/sedimentum-sichert-sich-3-3-millionen-fuer-die-eroberung-des-massenmarkts,0.0,0.0,2022-04-01,VC,Early Stage,ZG,Sedimentum AG (Helpany),Male
2378,"TX Ventures, Sparrow Ventures, existing investors, SICTIC",7.0,,,https://www.startupticker.ch/en/news/selma-finance-serie-a-runde-um-7-millionen-franken-erweitert,0.0,0.0,2022-09-01,VC,Early Stage,ZH,Selma Finance AG,Male
2379,Serpentine Ventures,,,,https://www.startupticker.ch/en/news/sepentine-ventures-invests-in-smart-socks,0.0,0.0,2022-04-01,VC,Early Stage,ZH,Capskin AG,Male
2380,"Sequoia Capital Scout Fund, private investors",,,,https://www.startupticker.ch/en/news/sequoia-invests-in-creable,0.0,0.0,2022-02-01,VC,Seed,SZ,creable AG,Male
2381,Höhle der Löwen Deutschland (Ralf Dümmel),,,,https://www.startupticker.ch/en/news/shea-yeah-holt-deal-fuer-schnelle-skalierung,0.0,0.0,2022-05-01,VC,Seed,ZH,SHEA YEAH,Female
2382,"bbv group, Rey Holding, CADFEM International",1.0,,,https://www.startupticker.ch/en/news/side-effects-sammelt-ueber-eine-million-franken-ein,0.0,0.0,2022-07-01,VC,Later Stage,ZH,Side Effects,Male
2248,"Partners Group, GIC, Baillie Gifford, Carbon Removal Partners, Global Founders Capital, John Doerr, M&G, Swiss Re, BigPoint Holding",600.0,1779.213398,,https://www.startupticker.ch/en/news/climeworks-raises-chf-6-million-in-latest-equity-round,0.0,0.0,2022-04-01,VC,Later Stage,ZH,Climeworks AG,Male
2249,"Rosablanche Venture, Vaudoise, Naef Holding",10.0,,,https://www.startupticker.ch/en/news/crowd-investment-platform-foxstone-raises-chf-1-million,0.0,0.0,2022-06-01,VC,Early Stage,GE,Foxstone SA,Male
2250,"Wingman Ventures, Big Idea Ventures, Proveg International, Blue Horizon, Arturo Elizondo, Lukas Böni, other angels within the FoodHack syndicate",,,,https://www.startupticker.ch/en/news/cultivated-biosciences-closes-Seed-investment,0.0,0.0,2022-09-01,VC,Seed,FR,Cultivated Biosciences SA,Male
2251,"Converge VC, New North Ventures, Founder Collective, Serpentine Ventures, CV VC, additional VCs, angels, private investors",4.8,,,https://www.startupticker.ch/en/news/cybera-banks-additional-5-million-to-fight-cybercrime,0.0,0.0,2022-09-01,VC,Early Stage,ZH,e24 AG,Male
2253,"Swisscom, private investors introduced through UBS Growth Advisory, ONE CREATION",4.0,,,https://www.startupticker.ch/en/news/daphne-technology-raises-an-additional-chf-4-million-from-strategic-investors,0.0,0.0,2022-03-01,VC,Later Stage,VD,Daphne Technology SA,Male
2254,"Fundamental Labs, OKEx Blockdream Ventures, Signum Capital, Animoca Brands",1.8,,,https://www.startupticker.ch/en/news/decentralized-gaming-platform-banks-2-million-Seed-capital,0.0,0.0,2022-02-01,VC,Seed,SH,BloGa Tech AG,Male
2255,"Eclipse Ventures, existing investors including Atlantic Labs, btov Partners, Paladin Capital Group",14.0,51.60313668,,https://www.startupticker.ch/en/news/decentriq-banks-usd15-million-to-enable-secure-and-compliant-data-collaboration,0.0,0.0,2022-03-01,VC,Early Stage,ZH,dq technologies AG (Decentriq),Male
2256,"private and institutional investors, Lakestar, family offices",54.9,,,https://www.startupticker.ch/en/news/deeptech-startup-banks-6m-to-deploy-quantum-as-a-service-technology,0.0,0.0,2022-01-01,VC,Early Stage,SG,Terra Quantum AG,Male
2257,"Ertan Wittwer, Fabrice Aeberhard, Business Angels",1.8,6.81,,https://www.startupticker.ch/en/news/dental-startup-mit-prominenten-investoren-auf-globalem-expansionskurs,0.0,0.0,2022-06-01,VC,Seed,ZH,Cobea AG (ALPINE WHITE),Male
2258,"Conny & Co, Quiet Capital, One Way Ventures, Liquid2 Ventures, Cathexis Ventures, ACE & Company, other investors",26.8,,,https://www.startupticker.ch/en/news/destinus-closes-29m-Seed-round,0.0,0.0,2022-02-01,VC,Seed,VD,Destinus SA,Male
2259,"Sun Hung Kai & Co., Animoca Brands, Wemade, SBI Holdings, SCB 10X, Meta Investments",82.4,655.0917974,,https://www.startupticker.ch/en/news/digital-asset-bank-sygnum-raises-9-million,0.0,0.0,2022-01-01,VC,Later Stage,ZH,Sygnum Bank AG,Male
2260,"Dialectic, Business Angels (Patricio Worthalter, Tim Beiko, Will Harborne, Kenneth Ng and Chris Waclawek)",0.93,,,https://www.startupticker.ch/en/news/digital-asset-lending-platform-pwn-raises-1-million,0.0,0.0,2022-02-01,VC,Seed,ZG,PWN AG,Male
2261,"Backbone Ventures, private investors",,,,https://www.startupticker.ch/en/news/digital-health-startup-aepsy-sichert-sich-finanzierung-in-millionenhoehe,0.0,0.0,2022-10-01,VC,Seed,ZH,Aepsy,Male
2262,"Revival Healthcare Capital, 415 CAPITAL, existing investors",82.58,,,https://www.startupticker.ch/en/news/distalmotion-raises-9m-to-accelerate-adoption-of-surgical-robot-dexter,0.0,0.0,2022-01-01,VC,Later Stage,VD,Distalmotion SA,Male
2263,"Alpine Group, NGM, private investors and existing users",1.5,,,https://www.startupticker.ch/en/news/edtech-start-up-alphacruncher-completes-chf-1-5-Seed-financing-round,0.0,0.0,2022-03-01,VC,Seed,SG,Alphacruncher AG,Male
2264,Volker Wendel,0.5,,,https://www.startupticker.ch/en/news/eine-halbe-million-fuer-filmemacher-kollaborationstool,0.0,0.0,2022-11-01,VC,Seed,ZH,PRODUCER AG,Male
2265,Business Angels,0.5,,,https://www.startupticker.ch/en/news/eine-halbe-million-fuer-kaqtu,0.0,0.0,2022-02-01,VC,Seed,ZH,KAQTU Design,Male
2266,Private investors,1.0,,,https://www.startupticker.ch/en/news/eine-million-franken-fuer-crypto-investment-plattform,0.0,0.0,2022-06-01,VC,Seed,ZG,pier wallet,Male
2267,"Pureos Bioventures, Novo Holdings",15.5,,,https://www.startupticker.ch/en/news/engimmune-therapeutics-raises-chf-15-5-million-in-Seed-financing,0.0,0.0,2022-05-01,VC,Seed,BS,Engimmune Therapeutics AG,Male
2268,Crest Rock Partners,,31.75,,https://www.startupticker.ch/en/news/enterprise-software-scale-up-pitcher-secures-growth-investment,0.0,0.0,2022-05-01,VC,Later Stage,ZH,Pitcher AG,Male
2269,Business Angels,0.28,,,https://www.startupticker.ch/en/news/erfolgreiche-pre-Seed-finanzierung-fuer-handelsplattform-fuer-alternative-vermoegenswerte,0.0,0.0,2022-02-01,VC,Seed,ZG,MARK Investment Holding AG,Male
2270,"VC Expa, HV Capital, SeedCamp, Wingman Ventures",5.2,20.80481135,,https://www.startupticker.ch/en/news/e-signing-solutions-provider-raises-5m-Seed-capital,0.0,0.0,2022-02-01,VC,Seed,ZH,Certifaction AG,Male
2271,"Serpentine Ventures, the ETH Foundation and SpanSet Inter AG",,8.0990412,,https://www.startupticker.ch/en/news/eth-spin-off-auxivo-secures-additional-funding,0.0,1.0,2022-01-01,VC,Seed,ZH,Auxivo AG,Male
2272,"True Ventures, Übermorgen, SICTIC, private investors",,,,https://www.startupticker.ch/en/news/exnaton-attracts-zurich-and-silicon-valley-investors,0.0,1.0,2022-10-01,VC,Early Stage,ZH,Exnaton AG,Female
2273,"Privilège Ventures, DAA Capital Partners, DART Labs Ventures, Gentian Investments AG, an angel investor",1.6,,,https://www.startupticker.ch/en/news/experience-creation-platform-wyth-raises-chf1-6m,0.0,0.0,2022-07-01,VC,Seed,TI,WYTH SA,Male
2274,"Vertex Ventures US, Sonae Investment Management, Berkeley SkyDeck Fund, SICTIC",3.8,,,https://www.startupticker.ch/en/news/experiential-reviews-platform-secures-4-million-Seed-capital,0.0,0.0,2022-04-01,VC,Seed,ZH,Experify AG,Male
2275,payabl. Group,3.0,,,https://www.startupticker.ch/en/news/fintech-startup-klarpay-ag-raises-chf-3m-to-accelerate-growth,0.0,0.0,2022-05-01,VC,Seed,ZG,Klarpay,Male
2276,"Elevator Ventures, family offices, EquityPitcher Ventures, Zürcher Kantonalbank ZKB, SIX Fintech Ventures",10.0,,,https://www.startupticker.ch/en/news/fintech-startup-vestr-closes-chf-1m-oversubscribed-round,0.0,0.0,2022-10-01,VC,Later Stage,ZG,vestr AG,Male
2277,"SBI Investment, Cargill, Verve Ventures, existing investors (Dow, ETF Partners, Swisscom, Future Industry Ventures)",15.0,,,https://www.startupticker.ch/en/news/flyability-secures-chf15-million,0.0,0.0,2022-09-01,VC,Later Stage,VD,Flyability SA,Male
2278,"Prediction Capital, 4SeeVentures and angels",5.2,,,https://www.startupticker.ch/en/news/foodetective-closes-5-5m-Seed-round,0.0,0.0,2022-11-01,VC,Seed,GE,PowerAPI SA,Male
2279,"FoodLabs, Siddhi Capital, EQT Ventures, ACME, Vala Capital, Revent, Square One Foods, private investors",1.1,,,https://www.startupticker.ch/en/news/foodhack-secures-funding-to-launch-hackventures-for-climate-tech-solutions,0.0,0.0,2022-06-01,VC,Seed,VD,HackVentures,Male
2280,"MSA Safety, Swisscanto Invest, Credit Suisse Entrepreneur Capital, Sony Innovation Fund, SICTIC",13.7,,,https://www.startupticker.ch/en/news/fotokite-secures-chf-13-7-million-to-expand-operations,0.0,0.0,2022-01-01,VC,Later Stage,ZH,Fotokite AG (Perspective Robotics AG),Male
2281,private investors,8.0,,,https://www.startupticker.ch/en/news/fresh-capital-and-a-new-acquisition-for-the-faction-collective,0.0,0.0,2022-09-01,VC,Later Stage,VS,The Faction Collective,Male
2282,"BOLD Capital Group Reef, DFG Capital, TRGC, BlueZilla VC, Shima Capital, DextForce, Poolz, AU21 Capital, Jump Trading",5.3,,,https://www.startupticker.ch/en/news/fresh-capital-and-seasoned-advisor-to-enhance-the-metaverse,0.0,0.0,2022-02-01,VC,Seed,ZH,pax.world (FRUSS AG),Male
2283,DART Labs Ventures,,,,https://www.startupticker.ch/en/news/fresh-capital-for-we-play-sport,0.0,0.0,2022-04-01,VC,Early Stage,VD,We Play Sport SA,Male
2284,"AT Capital Group, Future Energy Ventures, Japan Energy Fund, Shell Ventures",16.4,,,https://www.startupticker.ch/en/news/fresh-capital-to-accelerate-akselos-global-growth,0.0,0.0,2022-05-01,VC,Later Stage,VD,AKSELOS SA,Male
2285,"private investors, Business Angels Switzerland",,3.97500025,,https://www.startupticker.ch/en/news/frisches-geld-fuer-die-musikschul-plattform-von-matchspace,0.0,0.0,2022-01-01,VC,Early Stage,ZH,Matchspace AG,Male
2286,"private investors, SICTIC",6.0,,,https://www.startupticker.ch/en/news/frisches-geld-fuer-farmy,0.0,0.0,2022-11-01,VC,Later Stage,ZH,Farmy AG,Male
2287,n.a.,5.0,,,https://www.startupticker.ch/en/news/frisches-geld-fuer-geraet-gegen-herzinsuffizienz,0.0,0.0,2022-06-01,VC,Early Stage,ZG,Berlin Heals Holding AG,Male
2288,private investors,1.0,,,https://www.startupticker.ch/en/news/frisches-kapital-fuer-cleantech-startup-cowa,0.0,0.0,2022-06-01,VC,Early Stage,LU,Cowa Thermal Solutions AG,Male
2289,"Business Angels, Startfeld-Stiftung, SICTIC",1.0,,,https://www.startupticker.ch/en/news/frisches-kapital-fuer-textile-medtech-elektroden,0.0,0.0,2022-10-01,VC,Early Stage,SG,Nahtlos AG,Male
2290,"Qupar, Sigi Föhn",2.8,,,https://www.startupticker.ch/en/news/frisches-kapital-in-millionenhoehe-fuer-atemluft-analyseloesung-von-dbi,0.0,0.0,2022-07-01,VC,Seed,ZG,Deep Breath Intelligence AG,Male
2291,"Marcel Schneider, Peter Mettler",,1.31293265,,https://www.startupticker.ch/en/news/frisches-kapital-in-millionenhoehe-fuer-huperty,0.0,0.0,2022-03-01,VC,Seed,ZH,Huperty AG,Male
2292,Business angels & family office,0.5,,,https://www.startupticker.ch/en/news/fruitful-receives-half-a-million-in-pre-Seed-round,0.0,0.0,2022-10-01,VC,Seed,ZH,Fruitful AI,Male
2293,"TNF, Logitech, All Here, Tej Tadi",1.9,,,https://www.startupticker.ch/en/news/funding-round-brings-metaphysiks-one-step-closer-to-embodying-the-metaverse,0.0,0.0,2022-06-01,VC,Seed,VD,Metaphysiks Engineering SA,Male
2294,"Advent International, General Catalyst, Insight Partners, Permira",394.6,,,https://www.startupticker.ch/en/news/geneva-based-sonarsource-enters-unicorn-club,0.0,0.0,2022-04-01,VC,Later Stage,GE,SonarSource SA,Male
2295,"OpenOcean, Wingman Ventures",5.2,,,https://www.startupticker.ch/en/news/grandes-ambitions-pour-strong-network,0.0,0.0,2022-05-01,VC,Early Stage,VD,strong network SA,Male
2296,"Wallenius Wilhelmsen Group, btov Partners, VI Partners",,,,https://www.startupticker.ch/en/news/growth-funding-round-for-equippo,0.0,1.0,2022-02-01,VC,Later Stage,ZG,Equippo AG,Male
2297,"YZR, a Family Office",3.9,,,https://www.startupticker.ch/en/news/hair-skin-frisches-geld-fuer-auslandsexpansion,0.0,0.0,2022-10-01,VC,Later Stage,ZH,Hair and Skin Medical AG,Male
2298,"Zühlke Ventures, Lichtsteiner Foundation, business angels",,,,https://www.startupticker.ch/en/news/healios-ag-secures-substantial-funds-to-meet-demand,0.0,0.0,2022-08-01,VC,Early Stage,BS,Indivi (HEALIOS AG),Male
2299,"TX Group, PostFinance, SeedX Liechtenstein, Hypoport, Anamcara Capital, Plug and Play, Conny&Co, business angels",4.2,,,https://www.startupticker.ch/en/news/helvengo-sichert-sich-ueber-4-millionen-franken-fuer-expansion,0.0,0.0,2022-01-01,VC,Early Stage,ZH,helvengo AG,Male
